project_name,location,property_type,size,budget_range,timeline,service,year,client_goal,main_problem,scope,materials,challenge,solution,result,photos_available,testimonial,related_url,notes
Mont Kiara Luxury Condo Renovation,"Mont Kiara, Kuala Lumpur",Condo,"1,250 sq ft",NEEDS OWNER INPUT,8 weeks,Residential renovation,NEEDS OWNER INPUT,"A more premium look while keeping practical storage durable workmanship and clear budgeting",NEEDS OWNER INPUT,"Living room renovation; Feature wall; Built-in storage; Lighting coordination","Sintered stone; Walnut veneer; Matte laminate; Warm LED lighting",NEEDS OWNER INPUT,"Stone timber veneer concealed lighting and refined storage planning","Premium condo renovation with refined storage planning",yes,,/en/projects/mont-kiara-luxury-condo-renovation,"Public budget label: Premium residential renovation; image URL public on site"
Damansara Heights Semi-D Master Suite Upgrade,"Damansara Heights, Kuala Lumpur",Semi-D,"680 sq ft",NEEDS OWNER INPUT,6 weeks,Residential renovation,NEEDS OWNER INPUT,"A more premium look while keeping practical storage durable workmanship and clear budgeting",NEEDS OWNER INPUT,"Bedroom refurbishment; Wardrobe entry; Wall panels; Lighting upgrade","Upholstered panels; Tinted glass; Timber veneer; Marble side surfaces",NEEDS OWNER INPUT,"Hotel-inspired master suite with upholstered wall panels glass wardrobes and warm lighting","Calm premium master suite upgrade",yes,,/en/projects/damansara-heights-semi-d-refurbishment,"Public budget label: Master suite refurbishment; image URL public on site"
TTDI Bungalow Dining and Kitchen Renovation,"Taman Tun Dr Ismail, Kuala Lumpur",Bungalow,"920 sq ft",NEEDS OWNER INPUT,7 weeks,Kitchen and dining renovation,NEEDS OWNER INPUT,"A more premium look while keeping practical storage durable workmanship and clear budgeting",NEEDS OWNER INPUT,"Dry kitchen; Dining zone; Tall cabinet system; Glass partition","Quartz stone; Oak veneer; Fluted glass; Brass details",NEEDS OWNER INPUT,"Island counter tall cabinetry and better family circulation","Dining and kitchen upgrade centred on island counter and tall cabinetry",yes,,/en/projects/ttdi-bungalow-partial-renovation,"Public budget label: Kitchen and dining renovation; image URL public on site"
Kajang Landed House Modern Living Renovation,"Kajang, Selangor",Landed house,"1,480 sq ft",NEEDS OWNER INPUT,9 weeks,Landed house renovation,NEEDS OWNER INPUT,"A more premium look while keeping practical storage durable workmanship and clear budgeting",NEEDS OWNER INPUT,"Living room; Staircase feature; Wall finishes; Storage planning","Travertine; Oak timber; Black steel; Textured wall paint",NEEDS OWNER INPUT,"Staircase feature stone wall and more open modern living area","Landed house upgrade with modern living area",yes,,/en/projects/kajang-landed-house-modern-renovation,"Public budget label: Landed house renovation; image URL public on site"
Bukit Jalil Family Condo Study Corner Upgrade,"Bukit Jalil, Kuala Lumpur",Condo,"520 sq ft",NEEDS OWNER INPUT,4 weeks,Compact condo upgrade,NEEDS OWNER INPUT,"A more premium look while keeping practical storage durable workmanship and clear budgeting",NEEDS OWNER INPUT,"Study nook; Curved shelving; Compact storage; Living corner styling","Light oak laminate; Textured paint; Glass; Fabric upholstery",NEEDS OWNER INPUT,"Custom study nook curved shelving and practical hidden storage","Compact condo upgrade with study corner and storage",yes,,/en/projects/bukit-jalil-family-condo-upgrade,"Public budget label: Compact condo upgrade; image URL public on site"
Kota Damansara Clinic Reception Fit-Out,"Kota Damansara, Selangor",Clinic / commercial,"1,050 sq ft",NEEDS OWNER INPUT,6 weeks,Commercial fit-out,NEEDS OWNER INPUT,"A more premium look while keeping practical storage durable workmanship and clear budgeting",NEEDS OWNER INPUT,"Reception counter; Waiting area; Consultation corridor; Commercial lighting","Solid surface; Light oak veneer; Terrazzo; Frosted glass",NEEDS OWNER INPUT,"Curved counters soft lighting and calm professional finishes","Clinic reception fit-out with calm professional finishes",yes,,/en/projects/kota-damansara-clinic-fit-out,"Public budget label: Clinic commercial fit-out; image URL public on site"
